,show,rating,title,content,company,author,date
301,Tootsie,8,Tootsie,"This embraceably funny concoction goes by the title of ""Tootsie,"" which also was the title of its eternally endearing 1982 film source, starring Dustin Hoffman as a temperamental actor so desperate for a part he disguises himself as a woman to get it. The mantle of Michael Dorsey/Dorothy Michaels has been passed down on this occasion to the sublime Santino Fontana, who not only gets to strut his farcical stuff, but also sings, amazingly well, in two registers.",Washington Post,Peter Marks,04/23/2019
302,Tootsie,8,REVIEW: Broadway musical take on ‘Tootsie’ keeps laughs coming even as it deconstructs the 1982 movie,"There really is much to like about ""Tootsie."" Horn's book is chock-a-block with digressive one-liners that tickled me pink when I first saw the show in Chicago and worked their magic all over again on Broadway. Dorsey, a pill who taunts directors with his ego, has a lovable deadpanning roommate, Jeff (Andy Grotelueschen) and a wacky best frenemy named Sandy (Sarah Stiles), and this boffo comedic pair, along with John Behlmann's clueless bit of beefcake, keep the laughs rolling.",New York Daily News,Chris Jones,04/23/2019
303,Tootsie,8,"Review of Tootsie, starring Santino Fontana, on Broadway","The show stands or falls largely on the startlingly plausible shoulders of Santino Fontana as Michael Dorsey/Dorothy Michaels -- and there's no question that this reliable star of such musicals as R&H's Cinderella has made a break-out, star-making turn here that turns him into a leading player.",New York Theatre Guide,Mark Shenton,04/23/2019
304,Tootsie,8,"Tootsie: forget Dustin Hoffman, this new musical reinvents an ageing Hollywood hit - Broadway review","Just when you thought the old-fashioned musical comedy was dead, along comes an adaptation of a 37-year-old movie about sexism in the entertainment industry to breathe new life into it. David Yazbek and Robert Horn's Tootsie has the big dance numbers, frothy score, rat-a-tat jokes, and, in Santino Fontana, the kind of star turn from a triple threat that made the American musical such a pop cultural force fifty years ago. Directed with Swiss watch precision by Scott Ellis, Tootsie is an unexpected, charming delight.",Telegraph,Isaac Butler,04/23/2019
305,Tootsie,8,’Tootsie’ on Broadway review: A delicious update of a comedy classic,"All of this is directed with great spirit and charm by Scott Ellis, and it's held together by the extraordinary Fontina. More than just a marvelous physical feat - he changes personas and clothes with quicksilver grace - the performance never soft pedals Michael's steamroller ambition, even as Fontana makes us feel the character's desperation and frustration. Which is to say: You root for Michael even if he's sometimes an immense jerk.",NJ.com,Christopher Kelly,04/23/2019
306,Tootsie,8,"'Tootsie' review: As a woman, Santino Fontana is dressed to thrill","Throughout, it's all great fun, from the sick one-liners and cringeworthy puns to enough inside theater references to put ""Something Rotten"" to shame. (The opening night song ""The Most Important Night of My Life"" will never top ""Another Op'nin', Another Show,"" but it's still a delight). But as in the film, there are important take-aways, lessons Dorothy imparts to Michael about the trials women face. When he declares that ""being a woman is no job for a man,"" you sense overwhelming agreement from the women in the audience. But you get the feeling the men are at least listening.",Newsday,Barbara Schuler,04/23/2019
307,Tootsie,7,‘Tootsie’ on Broadway: A Cross-Dressing Classic Gets a Large Spoonful of Woke,"Tootsie as a musical is a confusing mélange, and not for the sexual and romantic attractions and farce-heavy confusions it sets in motion by lead character Michael Dorsey's (Santino Fontana) cross-dressing. The Broadway version of the 1982 movie-which starred Dustin Hoffman as Michael Dorsey/Dorothy Michaels-is both chaotic and apologetic, with a sharper and better book than it has music.",Daily Beast,Tim Teeman,04/23/2019
308,Tootsie,7,"Tootsie, with Santino Fontana, gets all dressed up for Broadway: EW review","All that said, the show is damn funny. The book, by Robert Horn, is jammed with laugh-out-loud one-liners, and Scott Ellis' direction allows those moments, and many others, to shine. The score, by Tony winner David Yazbek (The Band's Visit), and choreography by Denis Jones are light and lively. And William Ivey Long's costumes, including his recreation of Dustin Hoffman's iconic red sequined dress from the movie, are gorgeous, clever, and fresh.",Entertainment Weekly,Breanne L. Heldman,04/23/2019
309,Tootsie,6,Theater Review: Can Tootsie Work When It’s Not 1982?,"Fontana is pouring plenty of vigor and vocal vibrance into his role, but the truth is that Michael/Dorothy's charm falls pretty flat pretty fast. I found myself thinking of Andy Karl's similarly charismatic-and-self-absorbed performance as Phil Connors in Groundhog Day: Yes, the hero's a jerk. Yes, we know he's going to learn his lesson. But do we really want to dedicate our time to his lengthy, self-centered learning process - especially, in Tootsie, when the hero gets to spend so much of that process enjoying the spotlight? Despite its razzle-dazzle, Tootsie feels empty at the center. It's all but impossible to sympathize with the lead, and it's hard to be that interested in the woman he falls for.",Vulture,Sara Holdren,04/23/2019
310,Tootsie,5,‘Tootsie’ Broadway Review: Santino Fontana Can’t Fill Dustin Hoffman’s Heels in New Musical,"The good news is that book writer Robert Horn has not pulled a ""Pretty Woman"" and simply transcribed a screenplay, in this case, the Oscar-nominated 1982 script by Larry Gelbart, Murray Schisgal and many uncredited writers. Equally good, Horn supplies a few one-liners that are every bit as funny as the movie's zingers.",The Wrap,Robert Hofler,04/23/2019
311,Tootsie,5,WHAT A DRAG,"The new Broadway musical Tootsie is a story of transformation in which an actor becomes a better man after passing himself off as a woman. Based on a beloved 1982 movie starring Dustin Hoffman, the show by David Yazbek and Robert Horn unleashes more zippy one-liners and corny double entendres than anyone could ever want. But the film's sweeter charms and magic have gone missing in the metamorphosis from the screen to the stage of the Marquis Theatre.",Theatre News Online,Joe Dziemianowicz,04/23/2019
312,Tootsie,4,'Tootsie' review: Musical adaptation disappoints,"The writers deserve some credit for not blindly following the film and making changes to the setting and dialogue in an attempt to better suit it to a new medium, but the resulting product is substandard.",amNY,Matt Windman,04/23/2019
313,Waitress,9,"With Some Luck and Love, Her Life's Gonna Be ... So Sweet","It's easy as pie to fall for ""Waitress,"" a sweet comic musical returning Tony Award winner Jessie Mueller (""Beautiful"") to Broadway. Pop singer Sara Bareilles works a recurring chorus of those three ingredients, above, into many of the softly textured songs here, holding out the promise of scrumptious things to come.",NBC New York,Robert Kahn,04/24/2016
314,Waitress,9,Aisle View: Deep Dish Delite,"The third item in Sara Bareilles' score is what might be Broadway's first song about an e.p.t.; that is, an early pregnancy test. This suggests, early on, that this new musical-with score, book, direction and choreography by a quartet of women-is going to offer a somewhat different take on things. Which wouldn't matter if the results were subpar; but they are above-par, considerably so. The key statement is not that Waitress is a musical from a team of women, but that Waitress is a good musical from a creative team who happen to be women. (Jeanine Tesori and Lisa Kron's Fun Home-with one of Broadway's finest scores of the last quarter century-has already established the fact that gender has nothing to do with musical theatre excellence.)",Huffington Post,Steven Suskin,04/24/2016
315,Waitress,9,'Waitress' serves sweetness on Broadway,"""Sugar,"" ""butter"" and ""flour"" are the first words we hear in the new Broadway musicalWaitress (* * * ½ out of four) - simple ingredients that can produce scrumptious, and healing, results. That's certainly the case with this delightful adaptation of Adrienne Shelly's 2007 film, which followed a small-town gal trapped in an unhappy marriage but blessed with a prodigious talent for making pies. Arriving in a season that has brought Hamilton and now the majestically unsettling American Psycho, the new musical may initially strike you as - pardon the inescapable food metaphors - a modest confection.",USA Today,Elysa Gardner,04/24/2016
316,Waitress,8,Review: Jessie Mueller Serves a Slice of Life (With Pie) in Sara Bareilles’s ‘Waitress’,"Ms. Mueller, who won a Tony for her performance in ""Beautiful: The Carole King Musical,"" possesses a rich, soulful and emotionally translucent voice, and an ability to bring heaping cupfuls of subtext to her acting. But as with the unremarkable jukebox musical that brought her Broadway stardom, Ms. Mueller's talent often outstrips the material she's given here. So, incidentally, do the gifts of her supporting cast, who provide brightly colored, vibrantly sung performances....Much of the score, by the pop singer-songwriter Sara Bareilles, is appealing, drawing on the sounds of country music reflecting the Southern setting, but also containing more traditional Broadway-pop balladry. But the book by Jessie Nelson, based on the movie written and directed by (and co-starring) Adrienne Shelly, tends to flatten most of the characters into comic cartoons. (To be fair, they do not have much more depth in the movie, from which some of the musical's dialogue is borrowed.)",New York Times,Charles Isherwood,04/24/2016
317,Waitress,8,Broadway Review: ‘Waitress’ The Musical,"""Waitress"" owes its sweetness to the mouth-watering goodness of Jessie Mueller. As a diner waitress named Jenna, Mueller is such a honey bun, she melts us like the mounds of butter that make Jenna's homemade pies so luscious. The musical resorts to comic overkill to create characters based on Adrienne Shelly's 2007 indie rom-com. But Sara Bareilles has written a charming score that suits the quirky material and Mueller's dazzling voice and endearing personality.",Variety,Marilyn Stasio,04/24/2016
318,Waitress,8,Waitress,"Based on the 2007 indie film by the late writer-director Adrienne Shelly, Waitress has been whipped (I'll stop now) into an expertly constructed and emotionally satisfying tale of self-liberation in the face of limited options. Jessie Nelson's broadly comic yet brooding book meshes wonderfully with a frisky, bright score by pop star Sara Bareilles, a seasoned songwriter who lets the Beatles and other Britpop influences shine through. Bareilles's custom-built earworms address workplace pluck (""Opening Up""), first-date jitters (""When He Sees Me""), quirky, obsessive love (""Never Ever Getting Rid of Me"") and an eleventh-hour ballad of loss and regret (""She Used to Be Mine""), which will rip your heart out.",TimeOut NY,David Cote,04/24/2016
319,Waitress,8,'Waitress' is an intimate Broadway musical of the highest order,"Mueller's is a performance stripped of condescension, lived in the moment and rich in musical pleasures; surely there is no singing actress of Mueller's generation better able to play a woman of low power and self-esteem....In this show she immediately moves her lips whenever Jenna is asked a question - signaling to the audience that Jenna's main problem is that she worries so much about pleasing others that she never has learned how to put her own needs first. Jenna eventually grabs such an opportunity with her comely-but-married gynecologist (played by Drew Gehling), and it is here that the show stutters: Gehling's Dr. Pomatter feels like a sitcom doc rather than a serious love interest for a serious young woman, and thus you don't pull for them as you should. I had the same issue with Nick Cordero's Earl (Jenna's husband), played as a standard-issue man-spreader when the show would be better if you saw deeper into his anger and depression - especially since Bareilles has given him ""You Will Still Be Mine,"" one of the most poignant songs in the show.",Chicago Tribune,Chris Jones,04/24/2016
320,Waitress,8,'Waitress' serves up a slice of star power in Jessie Mueller,"Musicals commonly have a second-act problem. ""Waitress"" is one of the few that actually gets better as it goes along. Paulus' direction grows more supple, the quirks of the characters become more richly inhabited, the music travels to more poignant places and Mueller's performance just goes from strength to strength....Admittedly, the comic coincidences and plot conveniences don't stand the test of realism and the ending is sentimental in a non-rom-com way. But the show's heart is earned through the beauty and integrity of Mueller's work....In an era glutted with gifted musical theater performers, she stands out as a luminous everywoman.",LA Times,Charles McNulty,04/24/2016
321,Waitress,8,'Waitress': Theater Review,"Echoing a weakness in the original screen source, director Diane Paulus and choreographer Lorin Latarro could be criticized for overplaying the whimsy - there's so much going on in scene transitions, with ensemble members gliding around delivering pies, aprons and baking ingredients, that it all becomes a tad cutesy and distracting. But the material is anchored at every step by Bareilles' melodious pop score and Mueller's supremely natural performance as Jenna. While the stock characters that surround her may be familiar, they're a winsome bunch played by sterling performers. As her fellow waitresses - feisty, sass-mouthed Becky and mousy, borderline-OCD Dawn - Keala Settle and Kimiko Glenn are treasures, the dynamic among the three of them revealing the material's debt to Alice Doesn't Live Here Anymore.",Hollywood Reporter,David Rooney,04/24/2016
322,Waitress,8,Sara Bareilles’ Musical ‘Waitress’ Serves A Bittersweet Dish With Warmth And Humor: Broadway Review,"Mueller, who won the Tony Award for her portrayal of songwriter/singer Carole King in Beautiful, returns with another spectacular performance in the title role as Jenna, eking out a living in a roadside diner in the South where she has achieved local fame as a baker of transcendent pies named according to her state of mind, which ranges in any given day, hour, minute from whimsical to mordant....The positives far outnumber the negatives. Jenna is a heroine of the moment, taking control of her life and offering no apologies for her choices, even - or especially - the arguable ones. Mueller has a girl-next-door appeal that sublimates into something less earthbound when she sings, her pleasingly throbby mezzo a purring engine in ballads until she lets out the reins and the horsepower kicks in.",Deadline,Jeremy Gerard,04/24/2016
323,Waitress,8,"Ingredients of ‘Waitress’: Sara Bareilles, show tunes and syrup","It's surprising that ""Waitress's"" director, the resourceful Diane Paulus, who staged recent Broadway revivals of ""Hair"" and ""Pippin,"" would not have required the softening of at least one of Earl's monstrous edges, because he's a villain so transparently designed to provoke a specific response that - no disrespect to the highly competent, physically imposing Cordero - the character comes across as an inane contrivance. Some other supporting parts fare far, far better, as with an eccentric suitor for Dawn named Ogie, played to the wonderfully kooky hilt by Christopher Fitzgerald. The number late in Act 1 in which Ogie introduces himself to us, ""Never Ever Getting Rid of Me,"" jump-starts the proceedings with its effervescent spirit (and suggests that it might be fun if Ogie and Dawn got a spinoff musical of their own).",Washington Post,Peter Marks,04/24/2016
324,Waitress,8,Review: Broadway's 'Waitress' Has the Recipe for Success,"But the best part of this show is Mueller as piemaker Jenna, who won a Tony Award for playing Carole King in the musical ""Beautiful."" She combines earthiness, sexiness, timidity and dreaminess and her voice overflows with emotion. Listening to her sing the heartbreaking ""She Used to Be Mine"" is surely one of the very best things on Broadway this season.",Associated Press,Mark Kennedy,04/24/2016
325,Waitress,8,Waitress: EW stage review,"Sugar, butter, flour - there are plenty of those ingredients, particularly the sweet stuff, in the musical Waitress, which opened Sunday night at Broadway's Brooks Atkinson Theatre. They mix in a refrain heard throughout the production, as well as the elaborate pies the show's heroine crafts. And much like those desserts, Waitress is a sweet slice of a show that shines with the help of a star ingredient: Tony winner Jessie Mueller.",Entertainment Weekly,Jessica Derschowitz,04/24/2016
326,Waitress,8,"Theater Review: Waitress, Sweet and Sassy","Waitress can still be an uncomfortable genre mix: domestic-violence drama and workplace rom-com. That's in the source material, and the musicalization exaggerates it. What I certainly didn't expect, though, is that the musicalization could also help to justify the mismatch. As the story rushed toward its multiple conclusions - a typical Broadway problem the creative team was unable to solve - I began to understand that for these characters, life itself is an uncomfortable genre mix. Seeing that and sharing it is the start of their mastering it. Perhaps it really did take an all-female creative team to understand how such a story could be true, and how it could sing. If so, well, hand me a slice of that humble pie.",Vulture,Jesse Green,04/24/2016
327,Waitress,7,"‘Waitress’ Broadway Review: Sara Bareilles, Jessie Mueller Bake Up a Musical Storm","...something odd happens to this pie-crust thin story when Jenna, the resolute heroine, becomes Jenny, the singing doormat. Diane Paulus's direction and Jessie Nelson's book never let us forget that Jenna is victim, first and foremost. And so was her loving mother, who appears as a ghost, baking pies when she isn't being beaten up by her own thug of a husband....The result of all this marital and on-the-job abuse is that the men's behavior, past and present, overwhelms the show. The first act is well on its way to breaking out the razor blades when a very supporting character, played by Christopher Fitzgerald, lifts the show and proceeds to steal it....Fitzgerald is one of those great Broadway character actors who also has the acting chops and charisma to carry a show, but rarely gets the opportunity. (He dazzled in the lead role in the Ahmanson Theater's production of ""Minsky's,"" which sadly never made it to Broadway.)",The Wrap,Robert Hofler,04/24/2016
328,Waitress,7,"‘Waitress’ review: Too sweet, but Mueller keeps things real","The distinctions here include a rousing, comfort-food pop score by Sara Bareilles, the singer-songwriter in her confident Broadway composing debut, and the can't-miss casting of Jessie Mueller as Jenna. Mueller, whose down-to-earth authenticity as Carole King in ""Beautiful"" earned her a 2014 Tony, brings an unforced honesty and creamy, plaintive, intricately colored voice to a character who keeps things real when, all around her, things threaten to become showbiz pat.",Newsday,Linda Winer,04/24/2016
329,Waitress,7,Theater Review: 'Waitress',"The show's great, unintended irony is that her opportunity for success comes not from her resolve or ambition or even, really, her talent with pastry. It's because she was a friendly waitress, and her good nature was financially rewarded by a satisfied, wealthy, male customer.",Bergen Record,Robert Feldberg,04/24/2016
330,Waitress,6,"The musical 'Waitress' is cloying, annoying and way too sweet","The best thing to be said for ""Waitress"" is the brightly colored set design by Scott Pask, which features two giant, rotating pie cases on either side of the stage. Otherwise this musical feels like a few too many slices of a much too sugary pie. It sails right past feel-good and instead leaves you with a stomachache.",NJ.com,Christopher Kelly,04/24/2016
331,Waitress,6,Waitress review – pie-focused musical seems half-baked,"Under Diane Paulus' direction, the show at times seems to struggle to fill the stage. The book, written by Jessie Nelson and based on the film script, is nicely witty. But the choreography, by Lorin Latarro, seems an afterthought, and the songs, by the Grammy-winning artist Sara Bareilles, are tuneful, yet often strangely reticent, as though meant to be sung quietly to oneself rather than loudly before a crowd. Bad Idea, a duet between Jenna and Dr Pomatter, is a nicely rowdy exception, as is Jenna's heartfelt She Used to Be Mine. (One song for Ogie, Never Getting Rid of Me, is a showstopper; the other, I Love You Like a Table, a cheerful muddle.)",Guardian,Alexis Soloski,04/24/2016
332,Waitress,6,Jessie Mueller's star turn is baked to perfection in 'Waitress',"Director Diane Paulus (""Pippin"") does a fine job guiding actors to lively performances. But her staging is heavy-handed. The pie metaphor is unobtrusive on film, but it's force-fed on stage. Musicals, like dough, get stiff when overworked. Still, the show strikes a chord, in large part thanks to Mueuller's sweet and touching performance. In this fairy tale the girl loses the guy - and good riddance. Everybody wins. So do audiences with Mueller onstage.",NY Daily News,Joe Dziemianowicz,04/24/2016
333,Wicked,9,Something 'Wicked' comes to Broadway,"It's too soon to tell whether Schwartz's score for Wicked, which opened Thursday at the Gershwin Theatre, will prove as enduring. But it's safe to say that this is the most complete, and completely satisfying, new musical I've come across in a long time. The triumph is not Schwartz's alone. Adapted from a Gregory Maguire novel, Wicked offers a post-feminist, socially conscious reinterpretation of the story of Oz's Wicked Witch of the West. Though that may sound like a recipe for pretentious pedantry, writer Winnie Holzman, whose TV credits include thirtysomething and My So-Called Life, provides a libretto that juggles winning irreverence with thoughtfulness and heart.",USA Today,Elysa Gardner,10/30/2003
334,Wicked,9,Wicked,"Based on novelist Gregory Maguire's 1995 adult variation on the Wizard of Oz mythology, Wicked provides a prequel to the children's book and movie. The lavishly designed musical addresses complex themes, such as standards of beauty, individual morality and, believe it or not, opposing fascism. Thanks to Winnie Holzman's witty book and composer-lyricist Stephen Schwartz's robust and pop-inflected score, Wicked soars.",TimeOut New York,David Cote,10/30/2003
335,Wicked,5,There's Trouble in Emerald City,"As a parable of fascism and freedom, ""Wicked"" so overplays its hand that it seriously dilutes its power to disturb. Much of the impact of Baum's original novel, like that of so many fantasy stories, came from haunting, symbolic figures that readers interpret on their own terms. Though there have been numerous literary analyses of Baum's ""Oz"" as a coded case for populism and agrarian reform, the book never feels like a tract. ""Wicked,"" on the other hand, wears its political heart as if it were a slogan button. This is true not only of the dialogue, but also of Mr. Schwartz's generically impassioned songs, which have that to-the-barricades sound of the omninously underscored anthems of ""Les Misérables."" Though the talk is festooned with cutely mangled word (""swankified,"" ""thrillified,"" ""gratitution"") that bring to mind the language of Smurfs, there's a rock-hard lecture beneath the preciousness. Mr. Mantello reconciles the gap between form and content only in Ms. Chenoweth's performance.",New York Times,Ben Brantley,10/31/2003
336,Wicked,4,Wicked,"Described as a dense epic fantasy, 'Wicked,"" based on a novel, is an intricate work. It tells the story of Elphaba, the bright but neglected young girl born with green skin who is good and kind. How she turns into the wicked witch is a long, winding road filled with bizarre characters and strange plot twists. The problem with the show's book, by Winnie Holzman, is that it has to cover so much ground in a connect-the-dots fashion that we're deprived of the necessary depth and character development to make us really care about Elphaba or her unlikely friend Galinda, who later becomes Glinda the good witch. Director Joe Mantello handles the intimate scenes well, but he's not quite as successful moving the traffic on Eugene Lee's dark, mechanical set. The ensemble numbers are indistinguishable. The special effects were impressive but a show of this caliber needed more. Stephen Schwartz, the composer behind ""Godspell"" and ""Pippin,"" has written some lovely music, particularly his ballads for the witches, but the score is uneven and the beautiful melodies that marked his earlier works are disappointingly absent here.",NY1,Roma Torre,10/31/2003
