,show,rating,title,content,company,author,date
456,Ink,8,Ink,"So here comes another, focused yet again on Murdoch and the transformational effect he's had on how people consume the news in the modern age, on both sides of the Atlantic. ""Ink"" it is called, an engrossing, richly detailed play that had its official opening Wednesday at Manhattan Theatre Club's Samuel J. Friedman Theatre. It stars the magnetic Jonny Lee Miller as an editor converted rabidly to tabloid sensationalism and Bertie Carvel of ""Matilda""-the-musical fame as Murdoch, learning in the late '60s how to tack to the coordinates of readers' baser instincts.",Washington Post,Peter Marks,04/24/2019
457,Ink,8,"REVIEW: Broadway’s ‘Ink’ is juicy, colorful tale about the rise of right-wing media mogul Rupert Murdoch","Or as a populist mastermind who could see the cracks in the walls of the liberal elite's country clubs, who realized great storytelling always requires distinct heroes and villains, who knew one guy's fact always is another guy's fiction, and who figured out long before the other dumb media titans that user-generated content and ""Five hot things!"" was far more profitable than the tortured copy and long sentences favored by pontificating columnists and critics? Well, as they like to say at Fox News, the new Broadway play ""Ink"" mostly reports the facts. You decide, dear reader, you decide. At least you will have fun doing the deciding.",New York Daily News,Chris Jones,04/24/2019
458,Ink,8,Ink — mesmerisingly good tale of Murdoch and The Sun shines on Broadway,"Those two episodes constitute the dramatic heart of Graham's mesmerisingly accomplished play, whose 18-strong cast is directed by Rupert Goold with characteristic razzmatazz that cleverly evokes The Sun's own brand of infotainment.",Financial Times,Max McGuinness,04/24/2019
459,Ink,8,INK: SPRINGTIME FOR MURDOCH,"""Pander to and promote the most base instincts of people all you like, fine, create an appetite, but I warn you,"" Cudlipp says. ""You'll have to keep feeding it."" If it's too late to kill the beast Murdoch has nourished over decades, Ink at least encourages us to reflect on its growth-and, if we're fair, our own accountability in that.",New York Stage Review,Elysa Gardner,04/24/2019
460,Ink,8,DISRUPTING THE PRESS,"In the age of digital publishing, Ink offers an exhilarating look back at a print heyday and, in a sly conclusion, a peek at what was to come, as Murdoch tells Lamb of his plans in America. ""I'm thinking about buying a TV network over there."" But that's another story - and another five ""W""s.",Theatre News Online,Joe Dziemianowicz,04/24/2019
461,Ink,7,‘Ink’ Broadway Review: The Rise And Rise Of Rupert Murdoch & The Rewriting Of Fleet Street,Reflections on the heyday of scandalous Fleet Street likely won't stir Broadway audiences with the same vigor that roused the West End when Ink debuted there in 2017. Little matter. James Graham's play is so well-crafted that not knowing your Sun from your Mirror is a fairly minor hindrance.,Deadline,Greg Evans,04/24/2019
462,Ink,7,Ink,"The urgency of this context is an inescapable part of a drama that is more impressive as a species of theatrical journalism than as a form of imaginative playwriting. Although it may seem hard to credit, the road to Brexit and Donald Trump was paved by what happened when Murdoch bought a lackluster broadsheet and turbocharged it into a leading tabloid.",LA Times,Charles McNulty,04/24/2019
463,Ink,7,"Theater Review: In Ink, What’s Black and White and Rupert All Over","Carvel is a devilish delight to watch as Murdoch. He hikes his shoulders up and juts his head forward, giving him a vulturish vibe even in his loose, lanky frame. His mouth is always slightly open, his tongue creepily active - he's always hungry - and his eyes are like two tiny black lasers, constantly scanning the room. The director Matthew Warchus, who directed Carvel as the hideous headmistress in Matilda (for which he won a Tony), affectionately calls him a ""nose-putty actor"" - and it's true that there's something refreshingly broad and tricksterish about his style. Brits in general are more comfortable as character actors, knowingly playing games with their own bodies and voices. Americans tend to want to be serious heroes - we get stuck in our heads and our feels. Not that Murdoch and his editor-and-chief have no feelings, but Ink is in large part a story of ambition, which means that sparks of doubt, distaste, and conscience are systematically doused until it's too late.",Vulture,Sara Holdren,04/24/2019
464,Ink,6,‘Ink’ Broadway Review: Rupert Murdoch Gets Hit With a Puff Piece,"If you don't already appreciate ""Citizen Kane,"" the unnecessary first act of ""Ink"" will make you marvel at Orson Welles' economy and wit. Kane's creation of a tabloid is fun, insightful and, most important, Welles tells the story quickly. Graham, on the other hand, shows Lamb handpicking each staff member, and each portrait of these hardened journos is a cliché.",The Wrap,Robert Hofler,04/24/2019
465,Ink,4,Ink,"Why is there no drama here? Clearly, there were matters of life and death confronting these men. The choices Murdoch and his editor made 40 years ago-the race to the bottom, the destruction of journalistic ethics, the anti-immigrant rhetoric-still matter a great deal today. But although Graham labors hard to humanize Lamb with shadows of self-doubt, this psychological element is oversold and unconvincing, and we're left with a long show about a foregone conclusion.",TimeOut NY,Helen Shaw,04/24/2019
466,My Fair Lady,10,"My Fair Lady at Lincoln Center Theater Broadway, review – an Eliza for the MeToo movement","But what's especially lovely (or should that be ""loverly""?) is watching the tempestuous pair gradually fall in love. Ambrose brings a beautiful voice and a winning combination of humor, pluck and fragility to the role. Hadden-Paton mitigates some of Higgins's fury by yelling at Eliza in a tone that's more playful than patriarchal. Although the character is still a bundle of rage at times, it's clear his feelings for Eliza run deep.",The Telegraph,Diane Snyder,04/19/2018
467,My Fair Lady,10,"MY FAIR LADY: SHER’S NEW PRODUCTION, WARM AND TENDER AS IT CAN BE","Wouldn't it be loverly to have Lerner & Loewe's magical My Fair Lady back on Broadway? And wouldn't it be ""warm and tender"" if it were a tasteful staging which captured the style and grace of the fabled original? Well, Bartlett Sher's new staging at the Vivian Beaumont is and does. The Lincoln Center Theater My Fair Lady is absobloominutely loverly, and you can quote me on that.",New York Stage Review,Steven Suskin,04/19/2018
468,My Fair Lady,10,"My Fair Lady review at Vivian Beaumont Theater, New York – ‘glows with class’","Director Bartlett Sher's last spectacular revival at this address was The King and I, which is preparing to transfer to the London Palladium. He is now helming a Rolls Royce production of My Fair Lady, in Broadway's fourth revival of the title since the original production. It positively glows with class, shimmering with confidence and oozing with delight. But Sher also maintains the show's pertinent astringency, as it portrays how Professor Henry Higgins - a stubborn mule of a confirmed bachelor linguist who treats Eliza Doolittle as little more than a project to be manipulated and re-trained - is wrong-footed when she finally melts his own surprised heart. British actor Harry Hadden-Paton brings a nicely youthful yet appropriately flummoxed air to the role, and in what appears to be his first musical, carries the songs with conviction, too.",The Stage,Mark Shenton,04/19/2018
469,My Fair Lady,10,‘My Fair Lady’ review: Lauren Ambrose leads a ‘loverly’ revival,"The revival has been staged in Sher's familiar style of making a classic feel fresh and dynamic without totally disregarding the original script and score, incorporating superb production values (including a two-story revolving set for Higgins' home) and bringing out layered performances from great actors.",amNY,Matt Windman,04/19/2018
470,My Fair Lady,9,My Fair Lady returns to Broadway with a captivating new Eliza: EW review,"Higgins is as always a comically insufferable narcissist but Hadden-Paton (who played Bertie Pelham on Downton Abbey) gives him a shot of sex appeal, which helps. Norbert Leo Butz, as Eliza's foolish father, gives a showstopping performance. But this revival really seems to draw its energy from the women - from Ambrose's damaged and determined Eliza, as well as Diana Rigg (Diana Rigg!) as the dry, wise, seen-it-all queen of common sense, Mrs. Higgins. Their spirit, and their refusal to allow the ridiculous impulses of men go unchecked, points to the irony in the title: Sure she's fair, but she does not belong to you.",Entertainment Weekly,Jess Cagle,04/19/2018
471,My Fair Lady,9,"Review: Whose ‘Fair Lady’? This Time, Eliza’s in Charge","The plush and thrilling Lincoln Center Theater revival of Lerner and Loewe's ""My Fair Lady"" that opened on Thursday at the Vivian Beaumont Theater reveals Eliza Doolittle as a hero instead of a puppet - and reveals the musical, despite its provenance and male authorship, as an ur-text of the #MeToo moment. Indeed, that moment has made ""My Fair Lady,"" which had its Broadway premiere in 1956, better than it ever was.",New York Times,Jesse Green,04/19/2018
472,My Fair Lady,9,Broadway Review: ‘My Fair Lady’,"If you've got it, flaunt it. The splendid Beaumont stage at Lincoln Center was made for great classic musicals like Lerner and Loewe's ""My Fair Lady,"" and helmer Bartlett Sher was born to stage them. This jubilant revival is meticulously mounted and entirely welcome - despite the eccentric casting choice of Lauren Ambrose as Eliza Doolittle.",Variety,Marilyn Stasio,04/19/2018
473,My Fair Lady,9,‘My Fair Lady’ Broadway Review: Lauren Ambrose Would Even Wow George Bernard Shaw,"This visual splendor would amount to nothing more than a momentary ""Wow!"" if Sher hadn't imbued the Alan Jay Lerner and Frederick Loewe classic with performances that vividly conjure up George Bernard Shaw's original characters. Yes, the playwright never wanted his ""Pygmalion"" turned into a musical or a romance, but Sher's take on ""My Fair Lady"" brings the show closer to what the playwright had in mind.",The Wrap,Robert Hofler,04/19/2018
474,My Fair Lady,9,‘My Fair Lady’ review: It’s simply lover-ly,"Anticipation for the latest revival of ""My Fair Lady"" was high - the Lerner and Loewe classic, from 1956, had been absent from Broadway for nearly 25 years - but not entirely positive. After all, the story of a Cockney flower girl being bullied into learning upper-class speech by an abrasive male professor could feel out of touch, to put it mildly, in our modern climate. Happily, this Lincoln Center Theater production starring Lauren Ambrose and Harry Hadden-Paton is everything it needs to be, and quite a bit more.",Newsday,Elisabeth Vincentelli,04/19/2018
475,My Fair Lady,8,My Fair Lady review – dazzling Broadway revival is a sweet treat,"A splendiferous layer cake with a bittersweet core, Lerner and Loewe's My Fair Lady has returned to Broadway in a smashing new production from Bartlett Sher (The Sound of Music, The King and I). Expertly acted, pleasingly sung, and often visually splendid, it makes a good faith attempt to honor the show's history and intentions while also acknowledging the charged sexual politics of the moment. If its ending still doesn't satisfy, maybe that's because no My Fair Lady ending can.",The Guardian,Alexis Soloski,04/19/2018
476,My Fair Lady,8,‘My Fair Lady’ Review: Grown Accustomed to Success,"Of all the great Broadway musicals of the postwar era, ""My Fair Lady"" is the only one that takes a major work of literature, George Bernard Shaw's ""Pygmalion,"" and turns it into an equally distinguished musical that is true to the spirit and letter of its source material.",Wall Street Journal,Terry Teachout,04/19/2018
477,My Fair Lady,8,My Fair Lady,"The musical pulls out all the stops for a raucous production number, ""Get Me to the Church on Time,"" which marks the begrudging transformation of Eliza's father (Norbert Leo Butz, with his usual impatience de vivre) from ne'er-do-well to well-to-do. But its default mode is elegance. Sher is acutely alert to the shifts of balance within both My Fair Lady itself and the way it plays to contemporary audiences, and nowhere is that clearer than in his clever solution to the show's notoriously slippery ending. This revival has devised a way to have its scone and eat it too.",TimeOut NY,Adam Feldman,04/19/2018
478,My Fair Lady,8,'My Fair Lady': Theater Review,"The changes are minor enough to go virtually unnoticed but sufficiently considered to fuel discussion among those convinced this light period piece has problems that needed addressing. Beyond that, it's a polished production with an accomplished - if not spectacular - cast. But it doesn't come close to the sweeping cinematic fluidity of Sher's best work, which filled the immense Beaumont stage with a majestic breadth seldom equaled. Nor does it approach the thrilling emotional engagement of those earlier shows.",The Hollywood Reporter,David Rooney,04/19/2018
479,My Fair Lady,8,‘My Fair Lady’ Broadway Review: Lauren Ambrose’s Eliza Brings Fair Fight To Professor Henry Higgins,"While Carousel spins its gorgeous melodies and troublesome social politics in Midtown Manhattan, My Fair Lady, its lighter-hearted companion in the Big Book of treasured musicals toting outdated notions, has opened some 20 blocks north in a sumptuous Lincoln Center Theater production, its cast of 37 led by a tempestuous Lauren Ambrose and, in his Broadway debut, Harry Hadden-Paton, best known stateside for a Prince Charming turn on Downton Abbey but here making a right turn by going full-bore, unapologetic cad as that most arrogant of misogynists, Professor Henry Higgins.",Deadline,Greg Evans,04/19/2018
480,My Fair Lady,8,Theater Review: An Unaccustomed Approach to My Fair Lady,"Bartlett Sher's glowing revival of Lerner and Loewe's My Fair Lady has arrived at Lincoln Center to prove that it can be done. A beloved musical from another era can keep on kicking, and, as is the case here, it can even do so without making radical shifts in aesthetic, as long as it's got its eyes wide open.",Vulture,Sara Holdren,04/19/2018
481,My Fair Lady,6,Review: No changes of heart at all in this chilly 'My Fair Lady' at Lincoln Center on Broadway,"The production is colossal: Michael Yeargen's set includes several superfluous rooms in professor Higgins' house, the fast-tracked arrival of which makes full use of one of the deepest stages in the nation, plus several exteriors, including a grand vista of Covent Garden that looks precisely like the part of the old market where tourists and performers now gather. But it's also an uneasy combination of romantic realism, symbolism and miniaturization.",Chicago Tribune,Chris Jones,04/19/2018
482,The Ferryman,10,'The Ferryman' review: Sam Mendes directs a masterpiece,"In lesser hands, ""The Ferryman"" may have come off as pure hokum, but Mendes makes it absolutely entrancing, bringing out many intense, full-bodied performances, particularly from Donnelly, who brilliantly conveys Caitlin's raw vitality, vulnerability and stifled rage. Other key performances come from Flanagan, who offers an otherworldly, haunted presence and Considine, who gives the impression of a man walking a fine line between his past and present, burdened by guilt, bound to crack.",amNY,Matt Windman,10/21/2018
483,The Ferryman,10,Broadway Review: ‘The Ferryman’,"Glorious is not too strong a word for director Sam Mendes's production of Jez Butterworth's heartbreaker of a play, ""The Ferryman."" Flawless ensemble work by a large and splendid cast adds depth to the characters in this sprawling drama that is at once a domestic calamity and a political tragedy.",Variety,Marilyn Stasio,10/21/2018
484,The Ferryman,9,Review: A Thrilling ‘Ferryman’ Serves Up a Glorious Harvest Feast,"The last time a new drama with this breadth of scope and ambition appeared on Broadway was seven years ago. That was Mr. Butterworth's ""Jerusalem,"" in which a small-time, middle-aged country drug dealer (played by a monumental Mark Rylance) became a majestic emblem of an ancient, heroic England. With ""The Ferryman,"" Mr. Butterworth is again assessing the chokehold of a nation's past on its present. But now it is Northern Ireland at the height of the politically fraught period known as the Troubles. (We hear radio reports of the of the dying Irish Republican hunger striker in the Maze prison.) And he mines the folksy clichés of Irish archetypes - as garrulous, drink-loving, pugilistic souls - to find the crueler patterns of a centuries-old cycle of violence and vengeance.",New York Times,Ben Brantley,10/21/2018
485,The Ferryman,9,BWW Review: Jez Butterworth's Olivier-Winning THE FERRYMAN is A Harvest of Engaging Characters and Performances,"Butterworth takes his time unfolding details of his plot, focusing more on how a continuing political issue affects family dynamics spanning three generations, leading up to a tense and violent conclusion. Under Sam Mendes' empathetic direction, the wonderful ensemble company provides deeply-textured and entertaining performances. Despite the three and a quarter hour length (one intermission and a brief pause) the play flies by.",BroadwayWorld,Michael Dale,10/21/2018
486,The Ferryman,9,Review: 'The Ferryman' on Broadway is Jez Butterworth's epic story about a family in Troubles-era Northern Ireland,"It is a measure of the brilliance of Sam Mendes' direction, his uncommon ability to focus your eyes on a corner of this riot of characters, that you often forget Aunt Maggie even is there, sitting in a corner of her wheelchair reminding us that we all lose our mind eventually. The only moment of the show that feels theatrical, as distinct from real, is the tricky final violent climax, which this cast does not quite pull off.",Chicago Tribune,Chris Jones,10/21/2018
487,The Ferryman,9,Jez Butterworth’s ‘The Ferryman’ Sets a Gold Standard for Broadway Plays,"To be clear: Jez Butterworth's The Ferryman is a rollicking, moving, enveloping masterpiece, an emphatic herald of the strength and power of original playwriting on Broadway. It is deserving of every single award it won in London prior to coming to New York, and every award it should deservedly win while it is at the Bernard B. Jacobs Theatre, where it opened Sunday night.",Daily Beast,Tim Teeman,10/21/2018
488,The Ferryman,9,"‘The Ferryman’ Broadway Review: Jez Butterworth, Sam Mendes Reckon With The Banshees Of History","To reveal more would be indefensible, as Butterworth, under the impeccable direction of Mendes, with a flawless cast from young to old (including Fra Fee, Niall Wright and Carla Langley as the eldest Carneys), detail-perfect sets and costumes from Rob Howell, takes this play in directions you won't see coming. The Ferryman toys with what it knows we know - an exuberant Irish jig can't help but remind of Brian Friel's Dancing at Lughnasa, until it goes full-out punk. The gentle Of Mice and Men danger of Tom Kettle, the bloody shocks we've seen from the likes of Martin McDonagh - everything gets rearranged, and you just might gasp at the power and poetry that brings The Ferryman to a close even as you know it had to come to this.",Deadline,Greg Evans,10/21/2018
489,The Ferryman,9,'The Ferryman': Theater Review,"The performances are too good, right across the board, to single out all that merit recognition. But I particularly loved watching Flanagan emerge periodically from waking slumber, her eyes burning with feverish intensity. Another distinguished Irish stage veteran, Molloy, is so caustic as Aunt Pat that her words sting, but there's fathomless sadness beneath her bitter humor. O'Reilly cuts through Mary's fragile presence with a gorgeous speech that spills out of her toward the end, full of conflicting impulses of hurt and compassion. And Edwards' Tom Kettle is a figure of wrenching innocence and haunting pathos.",The Hollywood Reporter,David Rooney,10/21/2018
490,The Ferryman,9,'The Ferryman' review: Riveting drama about an Irish family during The Troubles,"That ominous opening weighs on everything that follows, as we meet that family, the Carney clan: Quinn (British film star Paddy Considine, who made his stage debut in the London production), his ailing wife Mary (Genevieve O'Reilly), his sister-in-law Caitlin (Donnelly) and assorted aunts, uncles, offspring and cousins. It is harvest day and there's much work - and feasting - to be done, the vivid family dynamics brought to life with care by a cast that has no weak links and by director Sam Mendes, a frequent Butterworth collaborator.",Newsday,Barbara Schuler,10/21/2018
491,The Ferryman,9,Theater Review: Livestock and Stock Types in The Ferryman,"The devil of it all is that is that, both despite and because of its flagrant use of formula, The Ferryman hooks us through the gills and pulls us along. After all, are we not entertained? There's a live goose, for God's sake. In the wake of the play's frantic, lurid, pull-out-all-the-stops-and-knock-down-all-the-pins conclusion (which makes the whole play feel like the prequel to an as-yet-unwritten bloodbath blockbuster called The Wrath of Quinn), the audience rocketed to its feet - and I got the reaction. Even though, when I stopped to think about it, at least three different elements of the story's final catastrophic 60 seconds left me wondering, ""Wait, but why?"" In a sense, set and costume designer Rob Howell's rendering of the Carneys' farmhouse, with its barrage of meticulous detail and its absurdly outsize proportions, is the perfect metaphor for the play itself: It's a head-trippy presentation of rich, authentic-seeming texture inside a romanticized, larger-than-life box - a gourmet meal by a very clever chef that somehow gives us the same uneasy satisfaction as Lucky Charms. ""That just... almost looked right,"" said the friend who saw it with me, whose family lives in Donegal, ""And... almost felt right. But...""",Vulture,Sara Holdren,10/21/2018
492,The Ferryman,9,"‘The Ferryman,’ an explosive, exhilarating human drama","As a portrait of a vengeance-obsessed culture drowning in its own spilled blood, ""The Ferryman"" is a searing social document. As a sprawling human drama, poised on the precipice of a violence that you know is waiting for its beguilingly drawn and assayed characters, it is a riveting work of art. It sprawls, too, in the most exhilarating sense of the term. Jez Butterworth's revenge tragedy, which marked its official opening Sunday night at Broadway's Bernard B. Jacobs Theatre, teems with people and the events that divide and imperil them.",Washington Post,Peter Marks,10/21/2018
493,The Ferryman,8,‘The Ferryman’ Broadway Review: Jez Butterworth and Sam Mendes Unload on the IRA,"""The Ferryman"" moves like an express, in part because we see its oars churning, even those that are borrowed. There's nothing subtle about it, and that includes most of the big, broad and often very busy performances that the Tony Awards like to honor. Where ""The Ferryman"" enters a totally original space is its thrilling third act, when those Corcoran nephews take center stage to recall attending Bobby Sands' funeral and falling under the influence the IRA.",The Wrap,Robert Hofler,10/21/2018
494,All My Sons,10,'All My Sons': Theater Review,"Reminiscent of Greek tragedy in its depiction of its central character's inexorable fall from grace, All My Sons can feel overly mechanistic at times. Some scenes, such as George's confrontation with Joe, the man he blames for his father's imprisonment, don't quite ring true in their quicksilver emotional shifts, and the play's symbolism can be heavy-handed (a downed tree is not just a downed tree). But the classically structured drama nonetheless still exerts a tremendous raw power that is fully realized in this rendering.",Hollywood Reporter,Frank Scheck,04/22/2019
495,All My Sons,10,ALL MY SONS: ARTHUR MILLER’S FAMILY-SECRETS TRAGEDY IN A-PLUS REVIVAL,"In a season where straight plays-often relegated to second-class Broadway status-have been in unusual number, this All My Sons goes a far way, or further, to reminding audiences what perceptive, inspired, engaged playwriting is. If anyone is leaving the Roundabout's American Airlines with a blithe ho-hum, I'll turn in my critic's spurs. If anyone is exiting the auditorium having seen the drama for the first time and wondering what all the fuss over Miller is about, I'm here to recommend a psychotherapist expert in healing emotional blockage.",New York Stage Review,David Finkle,04/22/2019
496,All My Sons,10,"With Annette Bening and Tracy Letts, All My Sons makes a harrowing return: EW review","It all comes together in a stellar, harrowing production that reinforces why Miller's works still endure so many decades later: The world is filled with hardships and horrors, but they can also be lurking in your own backyard.",Entertainment Weekly,Jessica Derschowitz,04/22/2019
497,All My Sons,9,'All My Sons' review: Tracy Letts and Annette Bening lead a rich revival of Miller classic,": Directed by three-time Tony winner Jack O'Brien (""Hairspray,"" ""Henry IV,"" ""The Coast of Utopia""), this revival gets to the heart of Miller's writing and brings out increasingly intense and layered performances, making for highly compelling and confrontational theater. Period costumes, an extensive exterior set design and video projections between scenes further enrich a fine production.",amNY,Matt Windman,04/22/2019
